{
  "$schema": "http://json-schema.org/draft-07/schema#",
  "type": "object",
  "properties": {
    "schemaVersion": {
      "type": "number",
      "const": 1
    },
    "id": {
      "type": "string",
      "format": "uuid",
      "pattern": "^([0-9a-fA-F]{8}-[0-9a-fA-F]{4}-[1-8][0-9a-fA-F]{3}-[89abAB][0-9a-fA-F]{3}-[0-9a-fA-F]{12}|00000000-0000-0000-0000-000000000000|ffffffff-ffff-ffff-ffff-ffffffffffff)$"
    },
    "changeSetId": {
      "type": "string",
      "format": "uuid",
      "pattern": "^([0-9a-fA-F]{8}-[0-9a-fA-F]{4}-[1-8][0-9a-fA-F]{3}-[89abAB][0-9a-fA-F]{3}-[0-9a-fA-F]{12}|00000000-0000-0000-0000-000000000000|ffffffff-ffff-ffff-ffff-ffffffffffff)$"
    },
    "createdAt": {
      "type": "string",
      "format": "date-time",
      "pattern": "^(?:(?:\\d\\d[2468][048]|\\d\\d[13579][26]|\\d\\d0[48]|[02468][048]00|[13579][26]00)-02-29|\\d{4}-(?:(?:0[13578]|1[02])-(?:0[1-9]|[12]\\d|3[01])|(?:0[469]|11)-(?:0[1-9]|[12]\\d|30)|(?:02)-(?:0[1-9]|1\\d|2[0-8])))T(?:(?:[01]\\d|2[0-3]):[0-5]\\d(?::[0-5]\\d(?:\\.\\d+)?)?(?:Z))$"
    },
    "canonicalHash": {
      "type": "string",
      "minLength": 1
    },
    "ownedPaths": {
      "type": "array",
      "items": {
        "type": "string",
        "minLength": 1
      }
    },
    "commands": {
      "type": "array",
      "items": {
        "type": "string",
        "minLength": 1
      }
    },
    "networkDestinations": {
      "type": "array",
      "items": {
        "type": "string",
        "minLength": 1
      }
    },
    "credentialReferences": {
      "type": "array",
      "items": {
        "type": "string",
        "minLength": 1
      }
    },
    "dependencies": {
      "type": "array",
      "items": {
        "type": "string",
        "minLength": 1
      }
    },
    "remoteResourceAuthorizations": {
      "type": "array",
      "items": {
        "type": "object",
        "properties": {
          "reference": {
            "type": "string",
            "minLength": 1
          },
          "highImpactFlags": {
            "type": "array",
            "items": {
              "type": "string",
              "enum": [
                "assignment",
                "reporter change",
                "closing transitions",
                "sprint completion",
                "attachments",
                "bulk mutations",
                "issue creation",
                "alert disabling",
                "contact points",
                "mute timings",
                "notification templates"
              ]
            }
          }
        },
        "required": [
          "reference",
          "highImpactFlags"
        ],
        "additionalProperties": false
      }
    },
    "temporaryServices": {
      "type": "array",
      "items": {
        "type": "string",
        "minLength": 1
      }
    },
    "prohibitedActions": {
      "type": "array",
      "items": {
        "type": "string",
        "minLength": 1
      }
    },
    "maxTurnsPerAttempt": {
      "default": 40,
      "type": "integer",
      "exclusiveMinimum": 0,
      "maximum": 9007199254740991
    },
    "provisionalBudgetHash": {
      "type": "string",
      "minLength": 1
    }
  },
  "required": [
    "schemaVersion",
    "id",
    "changeSetId",
    "createdAt",
    "canonicalHash",
    "ownedPaths",
    "commands",
    "networkDestinations",
    "credentialReferences",
    "dependencies",
    "remoteResourceAuthorizations",
    "temporaryServices",
    "prohibitedActions",
    "maxTurnsPerAttempt"
  ],
  "additionalProperties": false
}
