{
  "schemaVersion": 1,
  "id": "9f9f1710-41df-493f-82d4-05508a96b143",
  "changeSetId": "11111111-1111-4111-8111-111111111111",
  "createdAt": "2026-07-15T12:00:00.000Z",
  "canonicalHash": "sha256:237011c4a4d4c3333ba1c6fa5fbdee547d4aa2f7660038c60892620df3aabad7",
  "ownedPaths": [
    "packages/example/src/login/"
  ],
  "commands": [
    "npm test",
    "npm run build"
  ],
  "networkDestinations": [],
  "credentialReferences": [],
  "dependencies": [],
  "remoteResourceAuthorizations": [],
  "temporaryServices": [],
  "prohibitedActions": [
    "force-push main"
  ],
  "maxTurnsPerAttempt": 40,
  "provisionalBudgetHash": "sha256:0301821d8678f1a326e10dec1ef8761ee2eae6c6b533c9d8aa7857f91e7e04ca"
}
